{
  "lesson_id": "115AG3H03",
  "volume": {
    "code": "115AG3H",
    "publisher": "翰林",
    "grade": 3,
    "term": "上"
  },
  "unit": {
    "no": 1,
    "title": "TODO: 單元名稱待補"
  },
  "lesson_no": 3,
  "title": "提早五分鐘",
  "author": "林良",
  "blurb": "把遺失物品和匆忙行動連起來，找出提早準備如何減少遺漏。",
  "characters": [
    {
      "char": "統",
      "zhuyin": "ㄊㄨㄥˇ",
      "stroke_count": 11,
      "radical": "糸",
      "type": "習寫字",
      "level": "basic",
      "examples": [
        "統計",
        "總統",
        "傳統",
        "系統",
        "血統"
      ],
      "examples_source": "大腦與語言實驗室生字表（翰林／115上／三年級／第3課，2026-07-23）",
      "image": null,
      "audio_override": null,
      "pedia_url": "https://pedia.cloud.edu.tw/Entry/Detail?title=統",
      "source": "115G3A／翰林三上第3課官方教材與教師確認資料（生字表與教育百科字庫）",
      "status": "ready"
    },
    {
      "char": "票",
      "zhuyin": "ㄆㄧㄠˋ",
      "stroke_count": 11,
      "radical": "示",
      "type": "習寫字",
      "level": "basic",
      "examples": [
        "票價",
        "票房",
        "票選",
        "投票",
        "郵票"
      ],
      "examples_source": "大腦與語言實驗室生字表（翰林／115上／三年級／第3課，2026-07-23）",
      "image": null,
      "audio_override": null,
      "pedia_url": "https://pedia.cloud.edu.tw/Entry/Detail?title=票",
      "source": "115G3A／翰林三上第3課官方教材與教師確認資料（生字表與教育百科字庫）",
      "status": "ready"
    },
    {
      "char": "角",
      "zhuyin": "ㄐㄧㄠˇ",
      "stroke_count": 7,
      "radical": "角",
      "type": "習寫字",
      "level": "basic",
      "examples": [
        "角色",
        "角落",
        "角度",
        "主角",
        "三角"
      ],
      "examples_source": "大腦與語言實驗室生字表（翰林／115上／三年級／第3課，2026-07-23）",
      "image": null,
      "audio_override": null,
      "pedia_url": "https://pedia.cloud.edu.tw/Entry/Detail?title=角",
      "source": "115G3A／翰林三上第3課官方教材與教師確認資料（生字表與教育百科字庫）",
      "status": "ready",
      "videos": [
        {
          "title": "「漢字說故事」動畫 Ⅰ － 角",
          "url": "https://www.youtube.com/watch?v=zKGhVILJLxk",
          "source": "中華語文知識庫"
        }
      ],
      "etymology": {
        "structure": "象形",
        "components": [
          {
            "part": "角",
            "role": "象形",
            "note": "像獸角上的紋路"
          }
        ],
        "story": "「角」畫的是動物頭上的角，可以看到角上的紋路。所以「角」本來就是牛羊頭上的角，後來也用來說牆角、角落。",
        "source": "《說文解字．角部》：「角，獸角也。象形。」",
        "status": "approved",
        "approved_by": "CF",
        "approved_on": "2026-10-01"
      }
    },
    {
      "char": "板",
      "zhuyin": "ㄅㄢˇ",
      "stroke_count": 8,
      "radical": "木",
      "type": "習寫字",
      "level": "basic",
      "examples": [
        "板書",
        "黑板",
        "地板",
        "平板",
        "木板"
      ],
      "examples_source": "大腦與語言實驗室生字表（翰林／115上／三年級／第3課，2026-07-23）",
      "image": null,
      "audio_override": null,
      "pedia_url": "https://pedia.cloud.edu.tw/Entry/Detail?title=板",
      "source": "115G3A／翰林三上第3課官方教材與教師確認資料（生字表與教育百科字庫）",
      "status": "ready"
    },
    {
      "char": "業",
      "zhuyin": "ㄧㄝˋ",
      "stroke_count": 13,
      "radical": "木",
      "type": "習寫字",
      "level": "basic",
      "examples": [
        "作業",
        "畢業",
        "專業",
        "企業",
        "職業"
      ],
      "examples_source": "大腦與語言實驗室生字表（翰林／115上／三年級／第3課，2026-07-23）",
      "image": null,
      "audio_override": null,
      "pedia_url": "https://pedia.cloud.edu.tw/Entry/Detail?title=業",
      "source": "115G3A／翰林三上第3課官方教材與教師確認資料（生字表與教育百科字庫）",
      "status": "ready"
    },
    {
      "char": "本",
      "zhuyin": "ㄅㄣˇ",
      "stroke_count": 5,
      "radical": "木",
      "type": "習寫字",
      "level": "basic",
      "examples": [
        "本來",
        "基本",
        "課本",
        "根本",
        "原本"
      ],
      "examples_source": "大腦與語言實驗室生字表（翰林／115上／三年級／第3課，2026-07-23）",
      "image": null,
      "audio_override": null,
      "pedia_url": "https://pedia.cloud.edu.tw/Entry/Detail?title=本",
      "source": "115G3A／翰林三上第3課官方教材與教師確認資料（生字表與教育百科字庫）",
      "status": "ready"
    },
    {
      "char": "況",
      "zhuyin": "ㄎㄨㄤˋ",
      "stroke_count": 8,
      "radical": "水",
      "type": "習寫字",
      "level": "basic",
      "examples": [
        "情況",
        "狀況",
        "現況",
        "何況",
        "實況"
      ],
      "examples_source": "大腦與語言實驗室生字表（翰林／115上／三年級／第3課，2026-07-23）",
      "image": null,
      "audio_override": null,
      "pedia_url": "https://pedia.cloud.edu.tw/Entry/Detail?title=況",
      "source": "115G3A／翰林三上第3課官方教材與教師確認資料（生字表與教育百科字庫）",
      "status": "ready"
    },
    {
      "char": "該",
      "zhuyin": "ㄍㄞ",
      "stroke_count": 13,
      "radical": "言",
      "type": "習寫字",
      "level": "basic",
      "examples": [
        "應該",
        "活該",
        "該死",
        "不應該",
        "該不該"
      ],
      "examples_source": "大腦與語言實驗室生字表（翰林／115上／三年級／第3課，2026-07-23）",
      "image": null,
      "audio_override": null,
      "pedia_url": "https://pedia.cloud.edu.tw/Entry/Detail?title=該",
      "source": "115G3A／翰林三上第3課官方教材與教師確認資料（生字表與教育百科字庫）",
      "status": "ready"
    },
    {
      "char": "喊",
      "zhuyin": "ㄏㄢˇ",
      "stroke_count": 12,
      "radical": "口",
      "type": "習寫字",
      "level": "basic",
      "examples": [
        "大喊",
        "呼喊",
        "高喊",
        "叫喊",
        "喊叫"
      ],
      "examples_source": "大腦與語言實驗室生字表（翰林／115上／三年級／第3課，2026-07-23）",
      "image": null,
      "audio_override": null,
      "pedia_url": "https://pedia.cloud.edu.tw/Entry/Detail?title=喊",
      "source": "115G3A／翰林三上第3課官方教材與教師確認資料（生字表與教育百科字庫）",
      "status": "ready"
    },
    {
      "char": "文",
      "zhuyin": "ㄨㄣˊ",
      "stroke_count": 4,
      "radical": "文",
      "type": "習寫字",
      "level": "basic",
      "examples": [
        "文章",
        "文化",
        "文學",
        "作文",
        "文具"
      ],
      "examples_source": "大腦與語言實驗室生字表（翰林／115上／三年級／第3課，2026-07-23）",
      "image": null,
      "audio_override": null,
      "pedia_url": "https://pedia.cloud.edu.tw/Entry/Detail?title=文",
      "source": "115G3A／翰林三上第3課官方教材與教師確認資料（生字表與教育百科字庫）",
      "status": "ready"
    },
    {
      "char": "具",
      "zhuyin": "ㄐㄩˋ",
      "stroke_count": 8,
      "radical": "八",
      "type": "習寫字",
      "level": "basic",
      "examples": [
        "具備",
        "具體",
        "工具",
        "玩具",
        "文具"
      ],
      "examples_source": "大腦與語言實驗室生字表（翰林／115上／三年級／第3課，2026-07-23）",
      "image": null,
      "audio_override": null,
      "pedia_url": "https://pedia.cloud.edu.tw/Entry/Detail?title=具",
      "source": "115G3A／翰林三上第3課官方教材與教師確認資料（生字表與教育百科字庫）",
      "status": "ready"
    },
    {
      "char": "理",
      "zhuyin": "ㄌㄧˇ",
      "stroke_count": 11,
      "radical": "玉",
      "type": "習寫字",
      "level": "basic",
      "examples": [
        "理解",
        "理想",
        "道理",
        "管理",
        "整理"
      ],
      "examples_source": "大腦與語言實驗室生字表（翰林／115上／三年級／第3課，2026-07-23）",
      "image": null,
      "audio_override": null,
      "pedia_url": "https://pedia.cloud.edu.tw/Entry/Detail?title=理",
      "source": "115G3A／翰林三上第3課官方教材與教師確認資料（生字表與教育百科字庫）",
      "status": "ready"
    },
    {
      "char": "此",
      "zhuyin": "ㄘˇ",
      "stroke_count": 6,
      "radical": "止",
      "type": "習寫字",
      "level": "basic",
      "examples": [
        "因此",
        "如此",
        "彼此",
        "此外",
        "此時"
      ],
      "examples_source": "大腦與語言實驗室生字表（翰林／115上／三年級／第3課，2026-07-23）",
      "image": null,
      "audio_override": null,
      "pedia_url": "https://pedia.cloud.edu.tw/Entry/Detail?title=此",
      "source": "115G3A／翰林三上第3課官方教材與教師確認資料（生字表與教育百科字庫）",
      "status": "ready"
    },
    {
      "char": "備",
      "zhuyin": "ㄅㄟˋ",
      "stroke_count": 12,
      "radical": "人",
      "type": "習寫字",
      "level": "basic",
      "examples": [
        "準備",
        "設備",
        "具備",
        "預備",
        "裝備"
      ],
      "examples_source": "大腦與語言實驗室生字表（翰林／115上／三年級／第3課，2026-07-23）",
      "image": null,
      "audio_override": null,
      "pedia_url": "https://pedia.cloud.edu.tw/Entry/Detail?title=備",
      "source": "115G3A／翰林三上第3課官方教材與教師確認資料（生字表與教育百科字庫）",
      "status": "ready"
    },
    {
      "char": "易",
      "zhuyin": "ㄧˋ",
      "stroke_count": 8,
      "radical": "日",
      "type": "習寫字",
      "level": "basic",
      "examples": [
        "容易",
        "不易",
        "交易",
        "貿易",
        "簡易"
      ],
      "examples_source": "大腦與語言實驗室生字表（翰林／115上／三年級／第3課，2026-07-23）",
      "image": null,
      "audio_override": null,
      "pedia_url": "https://pedia.cloud.edu.tw/Entry/Detail?title=易",
      "source": "115G3A／翰林三上第3課官方教材與教師確認資料（生字表與教育百科字庫）",
      "status": "ready"
    },
    {
      "char": "匆",
      "zhuyin": "ㄘㄨㄥ",
      "stroke_count": 5,
      "radical": "勹",
      "type": "認讀字",
      "level": "challenge",
      "examples": [
        "匆忙",
        "匆匆",
        "匆促",
        "行色匆匆",
        "急匆匆"
      ],
      "examples_source": "大腦與語言實驗室生字表（翰林／115上／三年級／第3課，2026-07-23）",
      "image": null,
      "audio_override": null,
      "pedia_url": "https://pedia.cloud.edu.tw/Entry/Detail?title=匆",
      "source": "115G3A／翰林三上第3課官方教材與教師確認資料（生字表與教育百科字庫）",
      "status": "ready"
    },
    {
      "char": "餘",
      "zhuyin": "ㄩˊ",
      "stroke_count": 15,
      "radical": "食",
      "type": "認讀字",
      "level": "challenge",
      "examples": [
        "有餘",
        "其餘",
        "剩餘",
        "多餘",
        "廚餘"
      ],
      "examples_source": "大腦與語言實驗室生字表（翰林／115上／三年級／第3課，2026-07-23）",
      "image": null,
      "audio_override": null,
      "pedia_url": "https://pedia.cloud.edu.tw/Entry/Detail?title=餘",
      "source": "115G3A／翰林三上第3課官方教材與教師確認資料（生字表與教育百科字庫）",
      "status": "ready"
    }
  ],
  "words": [
    {
      "id": "word:115AG3H03:01",
      "word": "統計",
      "zhuyin": "ㄊㄨㄥˇ ㄐㄧˋ",
      "meaning": "總括計算。",
      "example_sentence": "爸爸用表格統計班上同學帶來的文具。",
      "example_status": "approved",
      "level": "basic",
      "image": "/assets/115AG3H/lesson03/vocabulary/l03-01.webp",
      "status": "ready",